{
  "id": "contract_review",
  "name": "Contract Review",
  "domain": "Legal Operations",
  "version": "1.0.0",
  "sourceSkillRef": "contract_review.skill.md",
  "certificationDate": "2026-05-22",
  "outcomeKey": "contract_review",
  "description": "Review contract text for non-legal-risk flags and escalation-ready questions."
}
